Family Guy Presents Stewie Griffin: The Untold Story;Family Guy Presents Collection/[2005] Family Guy Presents Stewie Griffin- The Untold Story
Star Wars;Star Wars- Episode IV - A New Hope
The Empire Strikes Back;Star Wars- Episode V - The Empire Strikes Back
Return of the Jedi;Star Wars- Episode VI - Return of the Jedi
Star Wars: The Force Awakens;Star Wars- Episode VII - The Force Awakens
Marvel One-Shot: The Consultant;Marvel One-Shot Collection/[2011] The Consultant
Marvel One-Shot: A Funny Thing Happened on the Way to Thor's Hammer;Marvel One-Shot Collection/[2011] A Funny Thing Happened on the Way to Thor's Hammer
Marvel One-Shot: Item 47;Marvel One-Shot Collection/[2012] Item 47
Marvel One-Shot: Agent Carter;Marvel One-Shot Collection/[2013] Agent Carter
Marvel One-Shot: All Hail the King;Marvel One-Shot Collection/[2014] All Hail the King
Dragons: Gift of the Night Fury;How to Train Your Dragon Collection/[2011] Dragons- Gift of the Night Fury
Book of Dragons;How to Train Your Dragon Collection/[2011] Book of Dragons
Buzz Lightyear of Star Command: The Adventure Begins;Toy Story Collection/[2000] Buzz Lightyear of Star Command- The Adventure Begins
Twilight;The Twilight Saga- Twilight
The Chronicles of Narnia: The Lion, the Witch and the Wardrobe;The Lion, The Witch and The Wardrobe
The Chronicles of Narnia: The Voyage of the Dawn Treader;The Voyage of the Dawn Treader
The Chronicles of Narnia: Prince Caspian;Prince Caspian
Kingsglaive: Final Fantasy XV;Final Fantasy XV- Kingsglaive
Kung Fu Panda Holiday;Kung Fu Panda Collection/[2010] Kung Fu Panda Holiday
Kung Fu Panda: Secrets of the Masters;Kung Fu Panda Collection/[2011] Kung Fu Panda- Secrets of the Masters
Iron Man;Marvel Collection/[2008] Iron Man
Iron Man 2;Marvel Collection/[2008] Iron Man 2
Captain America: The First Avenger;Marvel Collection/[2011] Captain America- The First Avenger
Captain America: The Winter Soldier;Marvel Collection/[2014] Captain America- The Winter Soldier
Captain America: Civil War;Marvel Collection/[2016] Captain America- Civil War
Captain Marvel;Marvel Collection/[2019] Captain Marvel
Guardians of the Galaxy;Marvel Collection/[2014] Guardians of the Galaxy
Guardians of the Galaxy Vol. 2;Marvel Collection/[2017] Guardians of the Galaxy Vol. 2
Avengers: Age of Ultron;Marvel Collection/[2015] Avengers- Age of Ultron
Thor;Marvel Collection/[2011] Thor
Thor: The Dark World;Marvel Collection/[2013] Thor- The Dark World
Thor: Ragnarok;Marvel Collection/[2017] Thor- Ragnarok
Solo: A Star Wars Story;Star Wars Collection\[2018] Solo- A Star Wars Story
Return to Oz;Oz Collection/[1985] Return to Oz